{
    "$schema": "http://json-schema.org/draft-07/schema#",
    "type": "array",
    "items": {
        "type": "object",
        "properties": {
            "name": {
                "$ref": "urn:definitions#/definitions/Name"
            },
            "desc": {
                "$ref": "urn:definitions#/definitions/Description"
            },
            "type": {
                "$ref": "urn:definitions#/definitions/Type"
            },
            "count": {
                "$ref": "urn:definitions#/definitions/RegionInt"
            },
            "addr": {
                "$ref": "urn:definitions#/definitions/RegionInt"
            },
            "cat": {
                "$ref": "urn:definitions#/definitions/Category"
            },
            "comp": {
                "$ref": "urn:definitions#/definitions/Compression"
            },
            "loc": {
                "$ref": "urn:definitions#/definitions/Location"
            }
        },
        "required": ["name", "type", "addr", "loc"],
        "additionalProperties": false
    }
}
